{
  "schema_version": "m4.1-successor-preparation-v1",
  "milestone": "M4",
  "revision": "M4.1",
  "status": "PREPARATION_ONLY",
  "predecessor": {
    "terminal_head": "f48ab8d7e835e9a57e65b75458faa786d696316d",
    "terminal_ci_run_id": 31246286753,
    "terminal_ci_conclusion": "success",
    "launch_claim": {
      "path": "evals/m4/execution/m4.0/launch-claim.json",
      "sha256": "5690177383c44a30e808533ebdfe0b504c6da2abf8e61a1d0303d4c439c3ecec",
      "git_blob_oid": "cfbcba7a28162ba489f3ed34effcf30ebebc499c"
    },
    "pre_dispatch_failure": {
      "path": "evals/m4/execution/m4.0/pre-dispatch-failure.json",
      "sha256": "8ef9487ce617aeafefc6d665a981581ffc046b541cf426f22d434be689f007ff",
      "git_blob_oid": "1a6bc8268adbfab7850daefac5f897c5e03f32aa"
    },
    "m4_0_authorization_token_status": "CONSUMED",
    "m4_0_task_ids_consumed": 60,
    "m4_0_observed_contexts": 0
  },
  "base_preparation": {
    "path": "evals/m4/preparation-manifest.json",
    "head": "c56c3c1ab384f65e51a70e9582672c6320d19121",
    "raw_sha256": "1838412c690c2000544999e955e399b4429289a698aa9467129f43fb0cd1bb76",
    "git_blob_oid": "196d19be1483b58f2f6f8bb67d76d9a3f8020d98",
    "task_count": 60,
    "source_order_sha256": "6a253573eb95e0234968a4ada557d36d69b2b5771d45dca8fe42a1c65d293ffb"
  },
  "authority": {
    "fresh_execution_authorized": false,
    "fresh_tasks_authorized": false,
    "result_writes_authorized": false,
    "retry_authorized": false,
    "repair_authorized": false,
    "authorization_artifact": null,
    "model_binding_status": "UNBOUND_UNTIL_SEPARATE_AUTHORIZATION"
  },
  "matrix": {
    "case_count": 12,
    "arm_count": 5,
    "planned_task_count": 60,
    "batch_count": 6,
    "batches": [
      {
        "batch_id": "M4.1-BATCH-NUC",
        "source_batch_id": "M4-BATCH-NUC",
        "domain": "nuclear_engineering",
        "task_ids": [
          "M4.1-NUC-A-F",
          "M4.1-NUC-B-A1",
          "M4.1-NUC-A-A1",
          "M4.1-NUC-B-A3",
          "M4.1-NUC-A-A2",
          "M4.1-NUC-B-F",
          "M4.1-NUC-A-N",
          "M4.1-NUC-B-A2",
          "M4.1-NUC-A-A3",
          "M4.1-NUC-B-N"
        ],
        "source_task_ids": [
          "M4-NUC-A-F",
          "M4-NUC-B-A1",
          "M4-NUC-A-A1",
          "M4-NUC-B-A3",
          "M4-NUC-A-A2",
          "M4-NUC-B-F",
          "M4-NUC-A-N",
          "M4-NUC-B-A2",
          "M4-NUC-A-A3",
          "M4-NUC-B-N"
        ],
        "planned_task_count": 10,
        "stop_on_infrastructure_or_protocol_failure": true,
        "later_batches_mutable_after_observation": false
      },
      {
        "batch_id": "M4.1-BATCH-MEC",
        "source_batch_id": "M4-BATCH-MEC",
        "domain": "mechanical_engineering",
        "task_ids": [
          "M4.1-MEC-A-N",
          "M4.1-MEC-A-A1",
          "M4.1-MEC-B-F",
          "M4.1-MEC-A-A3",
          "M4.1-MEC-B-A3",
          "M4.1-MEC-B-A1",
          "M4.1-MEC-B-A2",
          "M4.1-MEC-A-A2",
          "M4.1-MEC-A-F",
          "M4.1-MEC-B-N"
        ],
        "source_task_ids": [
          "M4-MEC-A-N",
          "M4-MEC-A-A1",
          "M4-MEC-B-F",
          "M4-MEC-A-A3",
          "M4-MEC-B-A3",
          "M4-MEC-B-A1",
          "M4-MEC-B-A2",
          "M4-MEC-A-A2",
          "M4-MEC-A-F",
          "M4-MEC-B-N"
        ],
        "planned_task_count": 10,
        "stop_on_infrastructure_or_protocol_failure": true,
        "later_batches_mutable_after_observation": false
      },
      {
        "batch_id": "M4.1-BATCH-ELE",
        "source_batch_id": "M4-BATCH-ELE",
        "domain": "electrical_engineering",
        "task_ids": [
          "M4.1-ELE-B-A2",
          "M4.1-ELE-B-A1",
          "M4.1-ELE-A-A1",
          "M4.1-ELE-A-N",
          "M4.1-ELE-A-F",
          "M4.1-ELE-B-A3",
          "M4.1-ELE-B-N",
          "M4.1-ELE-B-F",
          "M4.1-ELE-A-A3",
          "M4.1-ELE-A-A2"
        ],
        "source_task_ids": [
          "M4-ELE-B-A2",
          "M4-ELE-B-A1",
          "M4-ELE-A-A1",
          "M4-ELE-A-N",
          "M4-ELE-A-F",
          "M4-ELE-B-A3",
          "M4-ELE-B-N",
          "M4-ELE-B-F",
          "M4-ELE-A-A3",
          "M4-ELE-A-A2"
        ],
        "planned_task_count": 10,
        "stop_on_infrastructure_or_protocol_failure": true,
        "later_batches_mutable_after_observation": false
      },
      {
        "batch_id": "M4.1-BATCH-AUT",
        "source_batch_id": "M4-BATCH-AUT",
        "domain": "automation_control",
        "task_ids": [
          "M4.1-AUT-B-A2",
          "M4.1-AUT-B-A3",
          "M4.1-AUT-A-A3",
          "M4.1-AUT-B-A1",
          "M4.1-AUT-A-A1",
          "M4.1-AUT-B-N",
          "M4.1-AUT-A-A2",
          "M4.1-AUT-B-F",
          "M4.1-AUT-A-N",
          "M4.1-AUT-A-F"
        ],
        "source_task_ids": [
          "M4-AUT-B-A2",
          "M4-AUT-B-A3",
          "M4-AUT-A-A3",
          "M4-AUT-B-A1",
          "M4-AUT-A-A1",
          "M4-AUT-B-N",
          "M4-AUT-A-A2",
          "M4-AUT-B-F",
          "M4-AUT-A-N",
          "M4-AUT-A-F"
        ],
        "planned_task_count": 10,
        "stop_on_infrastructure_or_protocol_failure": true,
        "later_batches_mutable_after_observation": false
      },
      {
        "batch_id": "M4.1-BATCH-COM",
        "source_batch_id": "M4-BATCH-COM",
        "domain": "computer_data",
        "task_ids": [
          "M4.1-COM-B-F",
          "M4.1-COM-B-A1",
          "M4.1-COM-B-A2",
          "M4.1-COM-A-N",
          "M4.1-COM-B-N",
          "M4.1-COM-A-A3",
          "M4.1-COM-B-A3",
          "M4.1-COM-A-A2",
          "M4.1-COM-A-F",
          "M4.1-COM-A-A1"
        ],
        "source_task_ids": [
          "M4-COM-B-F",
          "M4-COM-B-A1",
          "M4-COM-B-A2",
          "M4-COM-A-N",
          "M4-COM-B-N",
          "M4-COM-A-A3",
          "M4-COM-B-A3",
          "M4-COM-A-A2",
          "M4-COM-A-F",
          "M4-COM-A-A1"
        ],
        "planned_task_count": 10,
        "stop_on_infrastructure_or_protocol_failure": true,
        "later_batches_mutable_after_observation": false
      },
      {
        "batch_id": "M4.1-BATCH-MPH",
        "source_batch_id": "M4-BATCH-MPH",
        "domain": "multiphysics",
        "task_ids": [
          "M4.1-MPH-B-F",
          "M4.1-MPH-A-N",
          "M4.1-MPH-A-A2",
          "M4.1-MPH-A-A1",
          "M4.1-MPH-A-A3",
          "M4.1-MPH-B-A2",
          "M4.1-MPH-A-F",
          "M4.1-MPH-B-N",
          "M4.1-MPH-B-A1",
          "M4.1-MPH-B-A3"
        ],
        "source_task_ids": [
          "M4-MPH-B-F",
          "M4-MPH-A-N",
          "M4-MPH-A-A2",
          "M4-MPH-A-A1",
          "M4-MPH-A-A3",
          "M4-MPH-B-A2",
          "M4-MPH-A-F",
          "M4-MPH-B-N",
          "M4-MPH-B-A1",
          "M4-MPH-B-A3"
        ],
        "planned_task_count": 10,
        "stop_on_infrastructure_or_protocol_failure": true,
        "later_batches_mutable_after_observation": false
      }
    ]
  },
  "randomization": {
    "frozen": true,
    "policy": "INHERITED_M4_0_RELATIVE_ORDER_WITH_DISJOINT_IDENTITIES",
    "source_seed": "m4.0-order-v1",
    "task_order": [
      "M4.1-ELE-B-A2",
      "M4.1-ELE-B-A1",
      "M4.1-MEC-A-N",
      "M4.1-NUC-A-F",
      "M4.1-NUC-B-A1",
      "M4.1-MPH-B-F",
      "M4.1-MEC-A-A1",
      "M4.1-COM-B-F",
      "M4.1-MEC-B-F",
      "M4.1-ELE-A-A1",
      "M4.1-NUC-A-A1",
      "M4.1-ELE-A-N",
      "M4.1-COM-B-A1",
      "M4.1-MPH-A-N",
      "M4.1-MEC-A-A3",
      "M4.1-AUT-B-A2",
      "M4.1-MEC-B-A3",
      "M4.1-AUT-B-A3",
      "M4.1-MPH-A-A2",
      "M4.1-ELE-A-F",
      "M4.1-NUC-B-A3",
      "M4.1-COM-B-A2",
      "M4.1-MPH-A-A1",
      "M4.1-AUT-A-A3",
      "M4.1-AUT-B-A1",
      "M4.1-COM-A-N",
      "M4.1-NUC-A-A2",
      "M4.1-COM-B-N",
      "M4.1-COM-A-A3",
      "M4.1-ELE-B-A3",
      "M4.1-ELE-B-N",
      "M4.1-AUT-A-A1",
      "M4.1-AUT-B-N",
      "M4.1-NUC-B-F",
      "M4.1-MPH-A-A3",
      "M4.1-AUT-A-A2",
      "M4.1-NUC-A-N",
      "M4.1-MPH-B-A2",
      "M4.1-ELE-B-F",
      "M4.1-MEC-B-A1",
      "M4.1-MEC-B-A2",
      "M4.1-COM-B-A3",
      "M4.1-AUT-B-F",
      "M4.1-NUC-B-A2",
      "M4.1-NUC-A-A3",
      "M4.1-MPH-A-F",
      "M4.1-COM-A-A2",
      "M4.1-COM-A-F",
      "M4.1-MPH-B-N",
      "M4.1-ELE-A-A3",
      "M4.1-AUT-A-N",
      "M4.1-COM-A-A1",
      "M4.1-MEC-A-A2",
      "M4.1-MEC-A-F",
      "M4.1-MPH-B-A1",
      "M4.1-MEC-B-N",
      "M4.1-ELE-A-A2",
      "M4.1-MPH-B-A3",
      "M4.1-AUT-A-F",
      "M4.1-NUC-B-N"
    ],
    "blind_mapping": {
      "M4.1-ELE-B-A2": "M4-J061",
      "M4.1-ELE-B-A1": "M4-J062",
      "M4.1-MEC-A-N": "M4-J063",
      "M4.1-NUC-A-F": "M4-J064",
      "M4.1-NUC-B-A1": "M4-J065",
      "M4.1-MPH-B-F": "M4-J066",
      "M4.1-MEC-A-A1": "M4-J067",
      "M4.1-COM-B-F": "M4-J068",
      "M4.1-MEC-B-F": "M4-J069",
      "M4.1-ELE-A-A1": "M4-J070",
      "M4.1-NUC-A-A1": "M4-J071",
      "M4.1-ELE-A-N": "M4-J072",
      "M4.1-COM-B-A1": "M4-J073",
      "M4.1-MPH-A-N": "M4-J074",
      "M4.1-MEC-A-A3": "M4-J075",
      "M4.1-AUT-B-A2": "M4-J076",
      "M4.1-MEC-B-A3": "M4-J077",
      "M4.1-AUT-B-A3": "M4-J078",
      "M4.1-MPH-A-A2": "M4-J079",
      "M4.1-ELE-A-F": "M4-J080",
      "M4.1-NUC-B-A3": "M4-J081",
      "M4.1-COM-B-A2": "M4-J082",
      "M4.1-MPH-A-A1": "M4-J083",
      "M4.1-AUT-A-A3": "M4-J084",
      "M4.1-AUT-B-A1": "M4-J085",
      "M4.1-COM-A-N": "M4-J086",
      "M4.1-NUC-A-A2": "M4-J087",
      "M4.1-COM-B-N": "M4-J088",
      "M4.1-COM-A-A3": "M4-J089",
      "M4.1-ELE-B-A3": "M4-J090",
      "M4.1-ELE-B-N": "M4-J091",
      "M4.1-AUT-A-A1": "M4-J092",
      "M4.1-AUT-B-N": "M4-J093",
      "M4.1-NUC-B-F": "M4-J094",
      "M4.1-MPH-A-A3": "M4-J095",
      "M4.1-AUT-A-A2": "M4-J096",
      "M4.1-NUC-A-N": "M4-J097",
      "M4.1-MPH-B-A2": "M4-J098",
      "M4.1-ELE-B-F": "M4-J099",
      "M4.1-MEC-B-A1": "M4-J100",
      "M4.1-MEC-B-A2": "M4-J101",
      "M4.1-COM-B-A3": "M4-J102",
      "M4.1-AUT-B-F": "M4-J103",